{
  "change_id": "CP-T00",
  "task_id": "T00",
  "base_ref": "origin/main",
  "branch": "change/t00-hdc-guard",
  "changed_files": [
    ".github/workflows/hdc-guard.yml",
    ".github/workflows/pages-review.yml",
    "contracts/acceptance-package.schema.json",
    "contracts/change-package.schema.json",
    "contracts/engineering-evidence.schema.json",
    "contracts/task-contract.schema.json",
    "governance/decisions/T00_HUMAN_GATE.md",
    "hdc/cli.py",
    "hdc/guard.py",
    "hdc/validator.py",
    "pyproject.toml",
    "scripts/build-review.sh",
    "tasks/T00/ACCEPTANCE.md",
    "tasks/T00/PROMPT.md",
    "tasks/T00/README.md",
    "tasks/T00/task.json",
    "tests/test_cli.py",
    "tests/test_contract_schemas.py",
    "tests/test_guard.py",
    "tests/test_state_model.py",
    "tests/test_validator.py",
    "ui/app.css",
    "ui/app.js",
    "ui/i18n/en-US.json",
    "ui/i18n/locales.json",
    "ui/i18n/vi-VN.json",
    "ui/i18n/zh-CN.json",
    "ui/index.html"
  ],
  "rationale": "Establish the enforceable HDC governance and verification baseline, including machine-verifiable contracts, validator, governance guard, CLI, CI enforcement, lifecycle/authority separation, multilingual review UI, and replayable verification."
}
